{
  "$schema": "./g2-launcher.schema.json",
  "schema_version": 2,
  "name": "G2 Launcher Community Catalog",
  "updated": "2026-10-17T08:17:54Z",
  "support_url": "https://github.com/sponsors/GenomiskDiagnostik",
  "apps": [
    {
      "name": "Send to G2",
      "package_id": "io.github.genomiskdiagnostik.sendtog2.sharedinbox",
      "version": "0.2.61",
      "description": "Local-first shared inbox, read/unread cards and screen-to-glasses tools for Even Realities G2.",
      "download_url": "https://raw.githubusercontent.com/GenomiskDiagnostik/g2-launcher/main/catalog-packages/send-to-g2.zip",
      "file_name": "send-to-g2-v0.2.61-launcher.zip",
      "sha256": "b52ce9fc605c46f299b818f58fb8134adc0f65a49e93f0061156409b4adf3d71",
      "size_bytes": 62151,
      "author": "GenomiskDiagnostik",
      "tags": [
        "sharing",
        "inbox",
        "screen share"
      ],
      "source_repository": "https://github.com/GenomiskDiagnostik/share-with-g2",
      "license": "Maintainer release",
      "min_launcher_version": "0.4.3"
    },
    {
      "name": "Mr. Know-it-all",
      "package_id": "io.thomas.g2.contextscout",
      "version": "0.1.19",
      "description": "Location-aware nearby point-of-interest scout using Wikipedia and OpenStreetMap Overpass.",
      "download_url": "https://raw.githubusercontent.com/GenomiskDiagnostik/g2-launcher/main/catalog-packages/mr-know-it-all.zip",
      "file_name": "mr-know-it-all-v0.1.19-launcher.zip",
      "sha256": "a4b6a69a2f2584f56d5f98f7a44af020673b6c2129f539a1a737ac36e75d9a5a",
      "size_bytes": 54378,
      "author": "GenomiskDiagnostik",
      "tags": [
        "location",
        "POI",
        "Wikipedia"
      ],
      "license": "Maintainer release",
      "min_launcher_version": "0.4.3"
    },
    {
      "name": "AR Weather Bearing",
      "package_id": "dk.sandy.g2.arweatherbearing",
      "version": "0.3.10",
      "description": "Directional weather HUD that samples Open-Meteo forecasts by bearing and distance.",
      "download_url": "https://raw.githubusercontent.com/GenomiskDiagnostik/g2-launcher/main/catalog-packages/ar-weather-bearing.zip",
      "file_name": "ar-weather-bearing-v0.3.10-launcher.zip",
      "sha256": "7a32d84386cf24dc07d854eb42a5e5808bc20dc237bcbf60dad05b6a8a9c2713",
      "size_bytes": 43095,
      "author": "GenomiskDiagnostik",
      "tags": [
        "weather",
        "location",
        "bearing"
      ],
      "license": "Maintainer release",
      "min_launcher_version": "0.4.3"
    },
    {
      "name": "Stereo Model Viewer",
      "package_id": "io.sandy.g2.stereoscopic.viewer",
      "version": "0.1.1",
      "description": "Local SBS stereoscopic image and STL/OBJ model viewer with R1 rotation controls.",
      "download_url": "https://raw.githubusercontent.com/GenomiskDiagnostik/g2-launcher/main/catalog-packages/stereo-model-viewer.zip",
      "file_name": "stereo-model-viewer-v0.1.1-launcher.zip",
      "sha256": "e8f1a6383f63540ca1bced211a38878983354fd26fb24b4b37352f09511f5b7e",
      "size_bytes": 58802,
      "author": "GenomiskDiagnostik",
      "tags": [
        "3D",
        "stereo",
        "viewer"
      ],
      "license": "Maintainer release",
      "min_launcher_version": "0.4.3"
    },
    {
      "name": "Trafik HUD",
      "package_id": "dk.thomas.trafikhud",
      "version": "0.1.0",
      "description": "Nearby Danish traffic events and roadworks from Vejdirektoratet/Dataudveksleren.",
      "download_url": "https://raw.githubusercontent.com/GenomiskDiagnostik/g2-launcher/main/catalog-packages/trafik-hud.zip",
      "file_name": "trafik-hud-v0.1.0-launcher.zip",
      "sha256": "ce36bfab782a4180cc24eb7041be62b8f4cba06aafba9fc2b6a423311220fea0",
      "size_bytes": 42788,
      "author": "GenomiskDiagnostik",
      "tags": [
        "traffic",
        "Denmark",
        "location"
      ],
      "license": "Maintainer release",
      "min_launcher_version": "0.4.3"
    },
    {
      "name": "R1 Ring Writer",
      "package_id": "io.g2.r1ringwriter",
      "version": "0.1.1",
      "description": "Local text document writing with a compact R1 ring / G2 touchpad stroke alphabet.",
      "download_url": "https://raw.githubusercontent.com/GenomiskDiagnostik/g2-launcher/main/catalog-packages/r1-ring-writer.zip",
      "file_name": "r1-ring-writer-v0.1.1-launcher.zip",
      "sha256": "3e3b5ef1a40d52ce31813f84563ba98d87319dd8f67aef43102f2ceba4577899",
      "size_bytes": 37424,
      "author": "GenomiskDiagnostik",
      "tags": [
        "writing",
        "R1",
        "local-first"
      ],
      "license": "Maintainer release",
      "min_launcher_version": "0.4.3"
    },
    {
      "name": "My Pomodoro",
      "package_id": "com.tarumzu.mypomodoro",
      "version": "0.1.4",
      "description": "Customizable Pomodoro timer with work/break cycles, session persistence and full glasses controls.",
      "download_url": "https://raw.githubusercontent.com/GenomiskDiagnostik/g2-launcher/main/catalog-packages/my-pomodoro.zip",
      "file_name": "my-pomodoro-v0.1.4-launcher.zip",
      "author": "tarumzu",
      "tags": [
        "productivity",
        "timer",
        "pomodoro"
      ],
      "source_repository": "https://github.com/tarumzu/my-pomodoro-even-g2",
      "license": "MIT",
      "min_launcher_version": "0.4.14",
      "upstream_commit": "89dea0e1877681a3b879a4ef64d667622741ba0a",
      "sha256": "9fea7e97669f334eabb90cfaf1954f9867ae606c8f5a562157984f91c771c488",
      "size_bytes": 38247
    },
    {
      "name": "Chess",
      "package_id": "com.harmon.chess",
      "version": "2.1.0",
      "description": "Chess for G2 with Stockfish play, Bullet Blitz and training modes, controlled from the R1/touchpad.",
      "download_url": "https://raw.githubusercontent.com/GenomiskDiagnostik/g2-launcher/main/catalog-packages/evenchess.zip",
      "file_name": "evenchess-v2.1.0-launcher.zip",
      "author": "Dustin Harmon",
      "tags": [
        "game",
        "chess",
        "offline"
      ],
      "source_repository": "https://github.com/dmyster145/EvenChess",
      "license": "MIT",
      "min_launcher_version": "0.4.14",
      "upstream_commit": "426a689e94bcb4bfac2911a332b44e5614c1c371",
      "launcher_patch": "Google Fonts links were removed from the phone help page; the corresponding network permission was removed. G2 game code is otherwise built from the pinned upstream commit.",
      "sha256": "24a50dd9997590cd8261e35df616c69d32cb465470397dff974e99d36d99fb1d",
      "size_bytes": 2667758
    },
    {
      "name": "Solitaire",
      "package_id": "com.harmon.solitaire",
      "version": "1.1.1",
      "description": "Klondike Solitaire for G2 with three-gesture controls, Move Assist and persistent save/resume.",
      "download_url": "https://raw.githubusercontent.com/GenomiskDiagnostik/g2-launcher/main/catalog-packages/evensolitaire.zip",
      "file_name": "evensolitaire-v1.1.1-launcher.zip",
      "author": "Dustin Harmon",
      "tags": [
        "game",
        "solitaire",
        "offline"
      ],
      "source_repository": "https://github.com/dmyster145/EvenSolitaire",
      "license": "MIT",
      "min_launcher_version": "0.4.14",
      "upstream_commit": "ca823277842c16150cda3917da428131e6edc822",
      "launcher_patch": "Google Fonts links were removed from the phone help page; the corresponding network permission was removed. G2 game code is otherwise built from the pinned upstream commit.",
      "sha256": "c6e6413aa5dbac46d200fd1a9590ffe7c6faa5a50e1b521c59b81c48b82baec5",
      "size_bytes": 129598
    }
  ]
}
